{"critical_chain":["event:1111111111111111111111111111111111111111111111111111111111111111","event:2222222222222222222222222222222222222222222222222222222222222222","event:3333333333333333333333333333333333333333333333333333333333333333","event:4444444444444444444444444444444444444444444444444444444444444444"],"receipts":{"counts":{"edges":10,"nodes":6},"edge_types_used":["before","causes","enables"]},"top_events":[{"downstream_reach":4,"event_id":"event:1111111111111111111111111111111111111111111111111111111111111111","fan_out":4,"score":44},{"downstream_reach":2,"event_id":"event:2222222222222222222222222222222222222222222222222222222222222222","fan_out":2,"score":22},{"downstream_reach":2,"event_id":"event:6666666666666666666666666666666666666666666666666666666666666666","fan_out":2,"score":22},{"downstream_reach":1,"event_id":"event:3333333333333333333333333333333333333333333333333333333333333333","fan_out":1,"score":11},{"downstream_reach":0,"event_id":"event:4444444444444444444444444444444444444444444444444444444444444444","fan_out":0,"score":0}],"top_k":5,"version":"1.0"}